"lambda_rel","doc_name","domain","question","layout_retrieved","gt","first_hit_rank","recall","source_range","source_file"
"1.0","D18-1287","Academic paper","How many more mean actions per instruction does the CHAI dataset have compared to the LANI dataset?","[6165, 6180, 6188, 6121, 6195, 6115, 6110, 6122, 6191, 6183]","[6165]","1","1.0","100-150","trial_report_best_lambda_1.0.csv"
"1.0","C18-1182","Academic paper","In Figure 4, what is the function of the components marked as 'Word LSTM-B' and 'Word LSTM-F'?","[168, 146, 6035, 157, 156, 5878, 6061, 178, 6043, 6062]","[168, 178]","1","1.0","100-150","trial_report_best_lambda_1.0.csv"
"1.0","C18-1182","Academic paper","According to Figure 3, what is the sequence followed to generate the final labels for Named Entity Recognition?","[157, 146, 168, 178, 6035, 6348, 6540, 197, 160, 165]","[168, 157]","1","1.0","100-150","trial_report_best_lambda_1.0.csv"
"1.0","C18-1182","Academic paper","According to Figure 1, how is each word in a sentence processed before being input to the LSTM layers?","[157, 168, 6035, 160, 178, 146, 5878, 173, 6043, 154]","[146, 134]","6","0.5","100-150","trial_report_best_lambda_1.0.csv"
"1.0","C18-1182","Academic paper","What is the purpose of the bidirectional LSTM layers (Char LSTM-B and Char LSTM-F) in the neural network in Figure 2?","[157, 168, 6035, 146, 5878, 178, 160, 6043, 5877, 156]","[146, 157]","1","1.0","100-150","trial_report_best_lambda_1.0.csv"
"1.0","C18-1182","Academic paper","Are the authors of the paper affiliated to the same institution?","[101, 6434, 6318, 5985, 6099, 107, 2803, 5238, 6243, 2]","[107]","6","1.0","100-150","trial_report_best_lambda_1.0.csv"
"1.0","FBS_S_ES_Public","Government","What are the primary concerns addressed by Bureau Objective 1.3?","[9644, 9641, 8709, 9816, 19354, 9879, 9643, 9815, 9646, 8825]","[9880, 9879]","6","0.5","100-150","trial_report_best_lambda_1.0.csv"
"1.0","FBS_S_ES_Public","Government","How does the Bureau plan to mitigate the risk of not seeking diversity?","[9894, 9033, 10078, 9126, 8639, 9457, 9031, 8890, 9035, 8728]","[9891, 9894]","1","0.5","100-150","trial_report_best_lambda_1.0.csv"
"1.0","FBS_F_Public-Accessible","Government","Is the Bureau aiming to establish and encourage evidence-based decision-making within senior leadership?","[8862, 8875, 8806, 8873, 8892, 8876, 9852, 19546, 19685, 10013]","[8875]","2","1.0","100-150","trial_report_best_lambda_1.0.csv"
"1.0","FBS_F_Public-Accessible","Government","What is the main risk associated with Bureau Objective 1.1?","[9326, 9631, 9635, 9633, 9084, 9497, 19635, 9418, 9929, 8818]","[8818, 8812]","10","0.5","100-150","trial_report_best_lambda_1.0.csv"
"1.0","FBS_F_Public-Accessible","Government","What is the date when the document was approved for public release?","[7529, 8786, 8672, 8746, 9549, 8781, 8767, 7791, 9694, 8252]","[8821, 8815]","Not Found","0.0","100-150","trial_report_best_lambda_1.0.csv"
"1.0","FY-2020-Agency-Financial-Report","Government","Did the Department comply with all FFMIA requirements?","[10599, 12016, 7117, 12015, 11823, 10411, 10598, 11828, 10594, 12012]","[10593, 10599]","1","0.5","100-150","trial_report_best_lambda_1.0.csv"
"1.0","FY-2020-Agency-Financial-Report","Government","What type of analysis did the Bureau of the Comptroller and Global Financial Services perform?","[12806, 11417, 10599, 7917, 12016, 7027, 7915, 7916, 11912, 11207]","[10593, 10599]","3","0.5","100-150","trial_report_best_lambda_1.0.csv"
"1.0","FY-2020-Agency-Financial-Report","Government","How many sections does the report consist of?","[6608, 10907, 11476, 11484, 12212, 6600, 5924, 10784, 10131, 3418]","[10104, 10100, 10102]","Not Found","0.0","100-150","trial_report_best_lambda_1.0.csv"
"1.0","FY-2020-Agency-Financial-Report","Government","What does the appendices include?","[11484, 6608, 6583, 10131, 11483, 6607, 11385, 12783, 7894, 11486]","[11393, 11386, 11396, 11421]","Not Found","0.0","100-150","trial_report_best_lambda_1.0.csv"
"1.0","DoS-Geospatial-Data-Strategy_Digital-Version_Accessible-9162021-with-Signature-page_Accessible-9222021","Government","Who is the Chief Data Officer at the Department of State?","[8255, 11859, 8120, 6790, 7897, 12786, 7565, 11694, 12610, 8982]","[8255]","1","1.0","100-150","trial_report_best_lambda_1.0.csv"
"1.0","DoS-Geospatial-Data-Strategy_Digital-Version_Accessible-9162021-with-Signature-page_Accessible-9222021","Government","By which department was the report released?","[6625, 12467, 7113, 7586, 7718, 6610, 11466, 11028, 7679, 7930]","[8110]","Not Found","0.0","100-150","trial_report_best_lambda_1.0.csv"
"1.0","DoS-Geospatial-Data-Strategy_Digital-Version_Accessible-9162021-with-Signature-page_Accessible-9222021","Government","On which page mentions the document change history?","[8115, 8251, 8252, 8116, 8114, 8104, 8106, 8105, 8107, 11529]","[8252]","3","1.0","100-150","trial_report_best_lambda_1.0.csv"
"1.0","International-Narcotics-Control-Strategy-Report-Volume-I-FINAL-1","Government","How much did the seizures of precursor chemicals increase in Kazakhstan from 2019 to the first nine months of 2020?","[18778, 18035, 17913, 18031, 17945, 18079, 18660, 18777, 18787, 15975]","[18768, 18778]","1","0.5","100-150","trial_report_best_lambda_1.0.csv"
"1.0","International-Narcotics-Control-Strategy-Report-Volume-I-FINAL-1","Government","What method is used in Mexico for methamphetamine production using substitute chemicals?","[18101, 15980, 18111, 15752, 15751, 15777, 18152, 18015, 15745, 15744]","[18101, 18093]","1","0.5","100-150","trial_report_best_lambda_1.0.csv"
"1.0","International-Narcotics-Control-Strategy-Report-Volume-I-FINAL-1","Government","Has the INCB deployed regional advisors to help with the issue of synthetic drugs and precursors?","[18163, 17680, 18164, 18159, 17881, 18148, 18161, 18147, 15835, 15721]","[18163]","1","1.0","100-150","trial_report_best_lambda_1.0.csv"
"1.0","International-Narcotics-Control-Strategy-Report-Volume-I-FINAL-1","Government","Is Afghanistan the world’s largest producer of illicit opiates?","[18170, 16022, 16213, 16959, 18996, 16246, 18189, 17900, 18295, 17103]","[18170]","1","1.0","100-150","trial_report_best_lambda_1.0.csv"
"1.0","FBS_EB_29July2022_Public","Government","Is the trade policy described in Bureau Objective 2.3 worker-centered?","[8698, 19565, 19385, 10039, 9350, 8689, 19563, 19493, 8764, 19577]","[8698, 8695]","1","0.5","100-150","trial_report_best_lambda_1.0.csv"
"1.0","FBS_IRF_Public","Government","What is the primary method mentioned for containing expenditures in the office?","[9276, 10001, 436, 10484, 6720, 7278, 12114, 11814, 1879, 6917]","[9276, 9271]","1","0.5","100-150","trial_report_best_lambda_1.0.csv"
"1.0","FBS_IRF_Public","Government","What might hinder the U.S.'s ability to achieve strategic prevention of religious freedom violations?","[9268, 9253, 9235, 8438, 9252, 9246, 19522, 9256, 11019, 9260]","[9268, 9262]","1","0.5","100-150","trial_report_best_lambda_1.0.csv"
"1.0","FBS_IRF_Public","Government","What specific date was the document approved?","[8672, 9549, 8746, 19474, 19470, 8580, 19324, 19480, 8781, 8767]","[9267, 9261]","Not Found","0.0","100-150","trial_report_best_lambda_1.0.csv"
"1.0","FBS_GCJ_Public","Government","Does the GCJ (Global Criminal Justice) advise the Department and interagency on the use of transitional justice tools?","[8906, 8935, 8949, 8955, 8907, 8910, 8952, 8917, 8958, 8942]","[8906, 8902]","1","0.5","100-150","trial_report_best_lambda_1.0.csv"
"1.0","FBS_GCJ_Public","Government","What is the purpose of the War Crimes Rewards Program implemented by the GCJ?","[8907, 8950, 8917, 7437, 7436, 12317, 8959, 7439, 8902, 7435]","[8907]","1","1.0","100-150","trial_report_best_lambda_1.0.csv"
"1.0","FBS_OES_28APR2023_PUBLIC","Government","Was the document approved before it was revised?","[8672, 9549, 9694, 14482, 12178, 17430, 8119, 10649, 10967, 11785]","[9549]","2","1.0","100-150","trial_report_best_lambda_1.0.csv"
"1.0","FBS_OES_28APR2023_PUBLIC","Government","How does OES plan to mitigate the risks associated with achieving climate goals and objectives?","[9582, 9576, 9565, 9578, 9585, 9580, 9588, 9571, 9599, 9568]","[9582]","1","1.0","100-150","trial_report_best_lambda_1.0.csv"
"1.0","FBS_OES_28APR2023_PUBLIC","Government","What is the goal that the Bureau Objective 1.1 supports regarding global conservation?","[9563, 9565, 9564, 9552, 9083, 9417, 9420, 9089, 9093, 19640]","[9562, 9564]","3","0.5","100-150","trial_report_best_lambda_1.0.csv"
"1.0","FBS_CDP_Public","Government","What is the objective number of the Bureau Cross-Cutting Management Objective discussed in the text?","[9773, 9204, 9049, 9678, 9768, 9211, 9051, 9535, 9209, 9684]","[8409, 8410, 8411, 8412]","Not Found","0.0","100-150","trial_report_best_lambda_1.0.csv"
"1.0","FBS_CDP_Public","Government","What is the page range for the 'Bureau Goals and Objectives' section?","[19530, 19527, 19519, 19504, 9831, 9560, 9012, 19522, 8748, 9413]","[8346]","Not Found","0.0","100-150","trial_report_best_lambda_1.0.csv"
"1.0","FBS_H_23FEB2022_PUBLIC-1","Government","How does Bureau Objective 2.1 support the JSP Goals overall?","[9093, 9015, 8755, 9086, 19644, 9099, 9083, 9431, 8691, 9027]","[9089, 9093]","1","0.5","100-150","trial_report_best_lambda_1.0.csv"
"1.0","FBS_H_23FEB2022_PUBLIC-1","Government","What is the purpose of Bureau Objective 1.2?","[9335, 9340, 8629, 8633, 8603, 8615, 9327, 8611, 9888, 9338]","[9085]","Not Found","0.0","100-150","trial_report_best_lambda_1.0.csv"
"1.0","FBS_CA_03NOV2023_PUBLIC","Government","How does the Bureau plan to reduce the risk of visa fraud through their future objectives?","[8610, 8313, 8337, 8609, 8311, 9180, 8310, 9650, 8335, 11214]","[8313, 8311]","2","1.0","100-150","trial_report_best_lambda_1.0.csv"
"1.0","FBS_CA_03NOV2023_PUBLIC","Government","What does the CA acronym stand for in the context of the document?","[8239, 8318, 7897, 8266, 11270, 8287, 11258, 8269, 12639, 8326]","[8264]","Not Found","0.0","100-150","trial_report_best_lambda_1.0.csv"
"1.0","FBS_CA_03NOV2023_PUBLIC","Government","What are the two main risks mentioned for the Management Objective Risk Consideration 1.6?","[8341, 9537, 8410, 8893, 9209, 19587, 19452, 9776, 9889, 8818]","[8341]","1","1.0","100-150","trial_report_best_lambda_1.0.csv"
"1.0","FY-2021-Agency-Financial-Report-508","Government","Does the Department serve as a payroll shared service provider for Federal agencies?","[11333, 12730, 11335, 7811, 11304, 7834, 10669, 12693, 12095, 7824]","[12730]","2","1.0","100-150","trial_report_best_lambda_1.0.csv"
"1.0","FY-2021-Agency-Financial-Report-508","Government","What solution is the Department implementing to replace legacy payroll systems?","[11334, 12731, 11335, 7845, 11337, 11333, 12730, 12732, 7840, 11277]","[12731]","2","1.0","100-150","trial_report_best_lambda_1.0.csv"
"1.0","FY-2021-Agency-Financial-Report-508","Government","Did the Unobligated Balance from Prior Year Budget Authority decrease from 2020 to 2021?","[7482, 10353, 12367, 10935, 11743, 6848, 10634, 7159, 7481, 10934]","[12053]","Not Found","0.0","100-150","trial_report_best_lambda_1.0.csv"
"1.0","FY-2021-Agency-Financial-Report-508","Government","How many authorized positions were vacant in the division overseeing DS contracts within the Bureau of Administration?","[12554, 12597, 12546, 7673, 8638, 8576, 11197, 8624, 12606, 12509]","[12554, 12546]","1","1.0","100-150","trial_report_best_lambda_1.0.csv"
"1.0","FBS_PM_29NOV2023_Public","Government","When was the document revised?","[9549, 8672, 12178, 9694, 10649, 11785, 11809, 12669, 12072, 7171]","[9694]","4","1.0","100-150","trial_report_best_lambda_1.0.csv"
"1.0","FBS_PM_29NOV2023_Public","Government","What strategies will the Bureau use to help partners better counter non-state threats?","[9716, 9698, 9154, 19353, 8548, 8443, 9715, 9379, 8457, 8485]","[9713, 9716]","1","0.5","100-150","trial_report_best_lambda_1.0.csv"
"1.0","JRS-EAP-Asia_06JAN2023_Public","Government","When was the document approved?","[8672, 9549, 8746, 8781, 8767, 8786, 9299, 19409, 19474, 19324]","[19470]","Not Found","0.0","100-150","trial_report_best_lambda_1.0.csv"
"1.0","JRS-EAP-Asia_06JAN2023_Public","Government","Which institutions or agencies release the document?","[6590, 12804, 6099, 11420, 7062, 10484, 12184, 7113, 14227, 3438]","[19456]","Not Found","0.0","100-150","trial_report_best_lambda_1.0.csv"
"1.0","JRS-EAP-Asia_06JAN2023_Public","Government","What are the potential consequences of inaction in addressing climate change mentioned in the document?","[19516, 19675, 19424, 19685, 19544, 11853, 6962, 19426, 19425, 19677]","[19513, 19516]","1","0.5","100-150","trial_report_best_lambda_1.0.csv"
"1.0","JRS-EAP-Asia_06JAN2023_Public","Government","Does the East Asia and Pacific Joint Regional Strategy (JRS) have classified goals?","[19466, 19530, 19316, 19502, 19500, 19317, 19504, 19507, 19481, 10242]","[19466]","1","1.0","100-150","trial_report_best_lambda_1.0.csv"
"1.0","Country_Reports_on_Terrorism_2020","Government","Which Lebanese law enforcement organization worked with external forces to enhance their counterterrorism capabilities?","[1900, 4356, 4357, 4393, 4909, 1809, 1938, 3629, 4389, 1369]","[4348, 4356]","2","0.5","100-150","trial_report_best_lambda_1.0.csv"
"1.0","FBS_L_27JAN2022_PUBLIC-1","Government","What is the greatest risk to the Department due to inadequate attorney staffing levels?","[9435, 9438, 9432, 9427, 9418, 9420, 9423, 9087, 9084, 7589]","[9418]","5","1.0","100-150","trial_report_best_lambda_1.0.csv"
"1.0","FBS_L_27JAN2022_PUBLIC-1","Government","What is the Bureau's strategy for enhancing its employees' skills?","[9412, 8800, 8742, 9521, 9121, 8618, 8590, 8988, 19338, 9021]","[9456, 9460]","Not Found","0.0","100-150","trial_report_best_lambda_1.0.csv"
"1.0","FBS_ISN_Public","Government","How many times does the document mention ""INSSG""?","[9731, 9289, 9732, 8939, 9291, 9298, 19644, 8769, 9293, 9221]","[9288, 9289, 9291, 9292, 9293, 9296, 9298]","2","0.57","100-150","trial_report_best_lambda_1.0.csv"
"1.0","FBS_ISN_Public","Government","What is the main content of the second-to-last page of the document?","[8116, 6577, 8115, 8112, 7906, 13687, 8114, 11453, 11897, 12818]","[9387, 9388, 9389, 9383]","Not Found","0.0","100-150","trial_report_best_lambda_1.0.csv"
"1.0","FBS_INL_Public","Government","What is the title of the document?","[13168, 879, 16850, 13759, 7415, 11102, 12784, 10871, 17070, 16725]","[9128]","Not Found","0.0","100-150","trial_report_best_lambda_1.0.csv"
"1.0","FBS_INL_Public","Government","What is the main focus of INL to mitigate the risks of criminals quickly adopting new methods of synthetic drug production?","[9159, 9177, 9169, 9154, 9158, 9166, 9164, 9176, 9189, 9133]","[9159]","1","1.0","100-150","trial_report_best_lambda_1.0.csv"
"1.0","FBS_INL_Public","Government","Is disrupting synthetic drug markets one of the objectives of Bureau Goal 1?","[9155, 9144, 9143, 9158, 9153, 19581, 9159, 9154, 9156, 9160]","[9144]","2","1.0","100-150","trial_report_best_lambda_1.0.csv"
"1.0","DOS-FY2023-Agency-Financial-Report-508","Government","On which page does the report present the chart of U.S. Department of State Organization?","[6669, 6668, 6667, 7908, 10502, 11920, 6589, 6588, 11464, 10194]","[6667, 6669]","1","1.0","100-150","trial_report_best_lambda_1.0.csv"
"1.0","FBS_DS_10JAN2022_PUBLICv2","Government","On which page does the report detail the Bureau Objective 4.2?","[8629, 9375, 19423, 9380, 10066, 9042, 9376, 19621, 8871, 9755]","[8626, 8630]","Not Found","0.0","100-150","trial_report_best_lambda_1.0.csv"
"1.0","FBS_S_GWI_Public","Government","What essential factors must be considered for S/GWI to foster regular outreach and coordination according to Bureau Objective 4.3?","[10071, 10055, 10040, 10058, 10013, 10025, 10070, 10037, 10067, 10051]","[10071]","1","1.0","100-150","trial_report_best_lambda_1.0.csv"
"1.0","FBS_S_GWI_Public","Government","What is the title of the document?","[13168, 879, 16850, 13759, 7415, 11102, 12784, 17070, 10871, 16725]","[9990]","Not Found","0.0","100-150","trial_report_best_lambda_1.0.csv"
"1.0","FBS_S_GWI_Public","Government","What is the major message conveyed in the last page?","[11486, 11897, 11485, 1167, 10134, 11450, 11488, 7014, 11476, 11487]","[10082, 10078]","Not Found","0.0","100-150","trial_report_best_lambda_1.0.csv"
"1.0","FBS_S_GAC_Public","Government","When was the document approved?","[8672, 9549, 8746, 8781, 8786, 8767, 9299, 19409, 19474, 19324]","[9925]","Not Found","0.0","100-150","trial_report_best_lambda_1.0.csv"
"1.0","FBS_S_GAC_Public","Government","Does PEPFAR have experience working with marginalized populations?","[9988, 9957, 9962, 9922, 9907, 9935, 9967, 19420, 9971, 19412]","[9988]","1","1.0","100-150","trial_report_best_lambda_1.0.csv"
"1.0","FBS_S_GAC_Public","Government","Will PEPFAR increase its funding and support for community-led monitoring?","[9935, 9942, 9972, 9981, 9940, 19420, 9945, 9943, 9967, 9957]","[9935]","1","1.0","100-150","trial_report_best_lambda_1.0.csv"
"1.0","FBS_OFM_10JAN2022_PUBLIC","Government","What institution or agency released the report?","[11906, 14179, 7108, 17686, 7020, 11997, 15993, 2382, 10111, 7930]","[9607]","Not Found","0.0","100-150","trial_report_best_lambda_1.0.csv"
"1.0","FBS_OBO_27APR2023v2_PUBLIC","Government","On which page does the document detail Bureau Objective 2.1?","[9335, 19643, 8608, 9660, 9658, 8450, 8763, 9661, 10033, 9259]","[9508]","Not Found","0.0","100-150","trial_report_best_lambda_1.0.csv"
"1.0","FBS_OBO_27APR2023v2_PUBLIC","Government","What specific areas will OBO incorporate Enterprise Risk Management (ERM) considerations into?","[9479, 9536, 9537, 9499, 10415, 11817, 9535, 9491, 11388, 6908]","[9479]","1","1.0","100-150","trial_report_best_lambda_1.0.csv"
"1.0","FBS_OBO_27APR2023v2_PUBLIC","Government","How many major sections are listed in the Table of Contents?","[8116, 19312, 8115, 8114, 9690, 19598, 17635, 9468, 9542, 8900]","[9467, 9468]","8","0.5","100-150","trial_report_best_lambda_1.0.csv"
"1.0","Country_Reports_2021_Complete_MASTER.no_maps-011323-Accessible","Government","Who is the former leader of Jemaah Islamiya that was released from prison in January 2021?","[2841, 2845, 2833, 5535, 2844, 5548, 5547, 5543, 5549, 5546]","[2841, 2830]","1","0.5","100-150","trial_report_best_lambda_1.0.csv"
"1.0","Country_Reports_2021_Complete_MASTER.no_maps-011323-Accessible","Government","What are the implications of Pakistan's International Border Management Security System with regard to border security enhancement?","[2166, 4612, 4291, 2164, 4610, 4627, 4642, 4513, 2197, 4586]","[2166]","1","1.0","100-150","trial_report_best_lambda_1.0.csv"
"1.0","FBS_PRM_Public","Government","What is the title of the document?","[13168, 879, 16850, 13759, 7415, 11102, 12784, 10871, 17070, 18694]","[9779]","Not Found","0.0","100-150","trial_report_best_lambda_1.0.csv"
"1.0","FBS_PRM_Public","Government","What is the main content of the last page of the document?","[8115, 7906, 8116, 8112, 12845, 6577, 8114, 11897, 105, 5969]","[9858, 9859, 9861, 9862]","Not Found","0.0","100-150","trial_report_best_lambda_1.0.csv"
"1.0","FBS_PRM_Public","Government","What organization provides technical assistance to governments for developing migration policies as per PRM funding?","[9843, 9789, 9816, 9786, 9835, 9838, 9785, 9826, 9852, 9830]","[9843, 9838]","1","1.0","100-150","trial_report_best_lambda_1.0.csv"
"1.0","JRS-AF_JRS_FINAL_Formatted_Public-Version","Government","What specific measures does Prosper Africa intend to implement to enhance trade relationships between the U.S. and Africa?","[19370, 19365, 19369, 19328, 19373, 19382, 19371, 19315, 19367, 19333]","[19369]","3","1.0","100-150","trial_report_best_lambda_1.0.csv"
"1.0","JRS-AF_JRS_FINAL_Formatted_Public-Version","Government","When was the document approved?","[8672, 9549, 8746, 8781, 8786, 8767, 9299, 19409, 19474, 19324]","[19409]","8","1.0","100-150","trial_report_best_lambda_1.0.csv"
"1.0","JRS-AF_JRS_FINAL_Formatted_Public-Version","Government","What sectors are mentioned where U.S. businesses are highly competitive in Africa?","[19368, 19382, 19365, 19370, 19371, 19449, 6669, 19373, 19369, 15645]","[19368]","1","1.0","100-150","trial_report_best_lambda_1.0.csv"
"1.0","JRS-AF_JRS_FINAL_Formatted_Public-Version","Government","What is the USAID Africa Trade and Investment Activity aimed to promote?","[19377, 19373, 19369, 8679, 8670, 19316, 5071, 5116, 19393, 1025]","[19377]","1","1.0","100-150","trial_report_best_lambda_1.0.csv"
"1.0","JRS-AF_JRS_FINAL_Formatted_Public-Version","Government","What section in the Table of Contents details the bureau's strategic planning approach?","[8975, 8733, 9611, 9468, 8647, 9993, 19459, 9782, 9901, 9056]","[19312]","Not Found","0.0","100-150","trial_report_best_lambda_1.0.csv"
"1.0","JRS-NEA-ME_JRS_FINAL_Formatted_Public-Version-1","Government","How many objectives are under the Bureau Goal 2?","[8761, 9940, 8812, 19522, 8848, 9964, 8449, 9091, 8299, 19384]","[19616, 19617, 19612]","Not Found","0.0","100-150","trial_report_best_lambda_1.0.csv"
"1.0","FBS_CT_Public","Government","Is disrupting terrorist financing a focus of the CT's efforts?","[8525, 8526, 8520, 4460, 4082, 1619, 3938, 1267, 8502, 1493]","[8531]","Not Found","0.0","100-150","trial_report_best_lambda_1.0.csv"
"1.0","FBS_CT_Public","Government","What page of the document outlines the ""Bureau Strategic Framework""?","[9542, 8733, 8791, 8739, 8498, 9993, 9550, 9216, 9867, 8478]","[8488]","Not Found","0.0","100-150","trial_report_best_lambda_1.0.csv"
"1.0","FBS_CSO_Public","Government","How does the Bureau plan to enhance its involvement in peace processes according to the strategic framework?","[8431, 10004, 8915, 9698, 19330, 10003, 8460, 8443, 8356, 19334]","[8451, 8452, 8454, 8455]","Not Found","0.0","100-150","trial_report_best_lambda_1.0.csv"
"1.0","FBS_CSO_Public","Government","Is the enhancement of CSO's competitiveness tied to the recruitment of a diverse workforce?","[8469, 8434, 8470, 8471, 8435, 9767, 8426, 11223, 8639, 8992]","[8434]","2","1.0","100-150","trial_report_best_lambda_1.0.csv"
"1.0","FBS_GTM_18FEB2022_PUBLIC","Government","Is GTM collaborating with the Secretary’s Office of Diversity and Inclusion to implement the DEIA Strategic Plan?","[8982, 9033, 9767, 7526, 9035, 9031, 8980, 7898, 9211, 9029]","[8982]","1","1.0","100-150","trial_report_best_lambda_1.0.csv"
"1.0","FBS_GTM_18FEB2022_PUBLIC","Government","What is the purpose of DEIA barrier analyses that GTM is participating in?","[8982, 9031, 9029, 8984, 9033, 9035, 8980, 8983, 9767, 11220]","[8982]","1","1.0","100-150","trial_report_best_lambda_1.0.csv"
"1.0","FBS_GTM_18FEB2022_PUBLIC","Government","What page does the Bureau Strategic Framework section begin on?","[8993, 8657, 8739, 19485, 9550, 9069, 9618, 9407, 9402, 8986]","[8986]","10","1.0","100-150","trial_report_best_lambda_1.0.csv"
"1.0","INCSR-Vol-INCSR-Vol.-I-1","Government","What law enforcement unit was created in Benin in January 2018?","[16145, 14030, 14024, 16146, 1360, 1048, 14104, 3914, 14039, 16087]","[16145, 16138]","1","0.5","100-150","trial_report_best_lambda_1.0.csv"
"1.0","INCSR-Vol-INCSR-Vol.-I-1","Government","What is the purpose of the General Law on Coca (Law 906)?","[18266, 16156, 16157, 16175, 18287, 14935, 16152, 17946, 3772, 17760]","[16156]","2","1.0","100-150","trial_report_best_lambda_1.0.csv"
"1.0","INCSR-Vol-INCSR-Vol.-2-pdf","Government","What is the mandate of the Financial Services Authority (FSA) in Saint Vincent and the Grenadines?","[15136, 15142, 15145, 15116, 15093, 13736, 15135, 15101, 15147, 15144]","[15136, 15123]","1","0.5","100-150","trial_report_best_lambda_1.0.csv"
"1.0","INCSR-Vol-INCSR-Vol.-2-pdf","Government","Did Albania see substantial progress in combating money laundering and financial crimes in 2018?","[13793, 13814, 15444, 14535, 1439, 14897, 13805, 13700, 14496, 1440]","[13793]","1","1.0","100-150","trial_report_best_lambda_1.0.csv"
"1.0","FBS_ECA_10JAN2022_PUBLIC","Government","Is bridging skills gaps in STEM and IT fields a part of ECA's endeavors?","[8764, 8780, 8776, 8747, 8778, 8782, 8761, 8758, 8752, 8779]","[8761, 8764]","1","1.0","100-150","trial_report_best_lambda_1.0.csv"
"1.0","FBS_ECA_10JAN2022_PUBLIC","Government","Does the ECA's strategy include improving media literacy to strengthen independent media?","[8768, 8766, 8762, 8770, 8780, 19548, 8738, 8745, 8737, 8736]","[8768, 8763]","1","0.5","100-150","trial_report_best_lambda_1.0.csv"
"1.0","FBS_ECA_10JAN2022_PUBLIC","Government","Does the ECA aim to completely eliminate negative experiences in exchange programs?","[8753, 8756, 8776, 8759, 8735, 8752, 8758, 8784, 8780, 8737]","[8756]","2","1.0","100-150","trial_report_best_lambda_1.0.csv"
"1.0","FBS_ECA_10JAN2022_PUBLIC","Government","What specific requirement does the ECA advocate for to counteract potential negative effects of U.S. government exchange programs?","[8759, 8778, 8753, 8738, 8776, 8761, 8766, 8735, 8764, 8757]","[8755, 8759]","1","0.5","100-150","trial_report_best_lambda_1.0.csv"
"0.0","Macbook_air","Guidebook","How many figures are shown in this guidebook to teach users ""Two-finger scrolling"" tips?","[5176, 5177, 5174, 5180, 5505, 5181, 5182, 5502, 5179, 5152]","[5176, 5177]","1","1.0","150-175","trial_report_best_lambda_0.0.csv"
"0.0","Macbook_air","Guidebook","According to this guideline, enumerate all jacks or ports located at the right side of MacBook Air.","[5163, 5165, 5164, 5160, 5162, 5161, 5167, 5056, 5031, 5062]","[5161, 5163]","1","1.0","150-175","trial_report_best_lambda_0.0.csv"
