"lambda_rel","doc_name","domain","question","layout_retrieved","gt","first_hit_rank","recall","source_range","source_file"
"0.0","indonesiamobilemarketresearch-ag-150106055934-conversion-gate02_95","Research report / Introduction","What are the Online Games native major internet companies and the Telecom Operator name of the second largest Prepaid ARPU in 2008? Please list the answer in list with reverse alphabetical order.","[8795, 8796, 8803, 8804, 8801, 8797, 8802, 8859, 10791, 8828]","[8828, 8796]","2","1.0","280-313","trial_report_best_lambda_0.0.csv"
"0.0","indonesiamobilemarketresearch-ag-150106055934-conversion-gate02_95","Research report / Introduction","In the slide that includes Mobile Internet Demographics and Trends, how many colors are there in the chart in the top right corner?","[8878, 8880, 8877, 8874, 8871, 8879, 8764, 8763, 8876, 8867]","[8877, 8878]","1","1.0","280-313","trial_report_best_lambda_0.0.csv"
"0.0","indonesiamobilemarketresearch-ag-150106055934-conversion-gate02_95","Research report / Introduction","What is the chart legend name that with a flag in the slide 31 have from 2008-2012?","[8795, 8796, 5391, 922, 20343, 20765, 20344, 4602, 4716, 17959]","[8867]","Not Found","0.0","280-313","trial_report_best_lambda_0.0.csv"
"0.0","obs-productdesc-en","Guidebook","How many ""objects"" with black color does the figure in Page 2 contains?","[24853, 25685, 25901, 24401, 19809, 24173, 24390, 24381, 9653, 25740]","[18747]","Not Found","0.0","280-313","trial_report_best_lambda_0.0.csv"
"0.0","obs-productdesc-en","Guidebook","What is the benefit of level-2 in the system has passed TRUCS in Page 8?","[18765, 18764, 18873, 12136, 12137, 10940, 14222, 14685, 12193, 22001]","[18761, 18764]","2","0.5","280-313","trial_report_best_lambda_0.0.csv"
"0.0","obs-productdesc-en","Guidebook","How many end-use mobile electronic devices are contained in the Enterprise cloud boxes (web disks) in the flow chart? ","[18828, 18822, 18825, 18785, 18821, 18814, 18767, 18806, 18792, 18799]","[18828, 18821]","1","1.0","280-313","trial_report_best_lambda_0.0.csv"
"0.0","obs-productdesc-en","Guidebook","How many common operations supported by each system-defined policy or role of OBS? Write down the answer in int format.","[18898, 18897, 18899, 18908, 18907, 18835, 18893, 18909, 18900, 18734]","[18897, 18899, 18900, 18901, 18902]","2","0.6","280-313","trial_report_best_lambda_0.0.csv"
"0.0","welcome-to-nus","Brochure","How many people with red shirt are there in the Page 14?","[17531, 26798, 16921, 26879, 21220, 21288, 26932, 26970, 1111, 20417]","[26879]","4","1.0","280-313","trial_report_best_lambda_0.0.csv"
"0.0","welcome-to-nus","Brochure","How many NUSSU constituent clubs and NUSSU committees are there respectively? Please write the answer in list format.","[26905, 26904, 26908, 26921, 26907, 26906, 26909, 26963, 26924, 26913]","[26912, 26910]","Not Found","0.0","280-313","trial_report_best_lambda_0.0.csv"
"0.0","welcome-to-nus","Brochure","How many people are there in the Figure from page 19 to page 21? Please write the answer in float format.","[21317, 21111, 20918, 21239, 21311, 21301, 24128, 24678, 21130, 21082]","[26932, 26925, 26919]","Not Found","0.0","280-313","trial_report_best_lambda_0.0.csv"
"0.0","welcome-to-nus","Brochure","How many Halls of Residence,  Residential colleges,  and studsent residences are there in NUS respectively? Please write the answer in list with ascending order, e.g., [""1"",""2""]","[26802, 26988, 27091, 26905, 26876, 26907, 26963, 26884, 26788, 27105]","[26988, 26994, 26995, 26996, 26998, 26999, 27000, 27002, 27007]","2","0.11","280-313","trial_report_best_lambda_0.0.csv"
"0.0","welcome-to-nus","Brochure","For the learning resources, which facilities are opened on Saturday in NUS Kent Ridge Campus? Give me a list.","[26802, 26803, 26908, 26800, 26923, 27105, 26807, 26919, 27031, 27013]","[27040, 27044, 27016, 27049, 27035, 27036]","Not Found","0.0","280-313","trial_report_best_lambda_0.0.csv"
"0.0","f8d3a162ab9507e021d83dd109118b60","Administration/Industry file","How many quizzes are there in the entire course?","[836, 605, 818, 805, 811, 619, 596, 823, 795, 599]","[805, 811, 818, 823, 795, 796, 799]","3","0.71","280-313","trial_report_best_lambda_0.0.csv"
"0.0","f8d3a162ab9507e021d83dd109118b60","Administration/Industry file","How many quizzes are there in units 4, 5, and 6 combined?","[805, 654, 823, 818, 633, 689, 705, 811, 799, 6202]","[633, 641, 654]","2","0.67","280-313","trial_report_best_lambda_0.0.csv"
"0.0","f8d3a162ab9507e021d83dd109118b60","Administration/Industry file","How many lines are highlighted in yellow on the first page? Give me an integer.","[18076, 19759, 24853, 1745, 14625, 19683, 1147, 8915, 8903, 18101]","[596]","Not Found","0.0","280-313","trial_report_best_lambda_0.0.csv"
"0.0","f8d3a162ab9507e021d83dd109118b60","Administration/Industry file","How to prepare for Tomorrow's Workplace Skills for QUARTER 3? ","[819, 821, 820, 816, 824, 806, 646, 692, 716, 645]","[819, 797]","1","0.5","280-313","trial_report_best_lambda_0.0.csv"
"0.0","f8d3a162ab9507e021d83dd109118b60","Administration/Industry file","what are the names of Unit 1 and Unit 2 in Semester 1:quarter 1?","[641, 794, 814, 813, 823, 619, 795, 826, 793, 689]","[609, 615]","Not Found","0.0","280-313","trial_report_best_lambda_0.0.csv"
"0.0","f8d3a162ab9507e021d83dd109118b60","Administration/Industry file","What is the title of case study given under unit-8 in table?","[811, 671, 799, 810, 670, 619, 665, 800, 675, 797]","[671]","2","1.0","280-313","trial_report_best_lambda_0.0.csv"
"0.0","f8d3a162ab9507e021d83dd109118b60","Administration/Industry file","How many critical thinking case studies are included in all the assignments?","[619, 811, 671, 797, 800, 627, 799, 798, 796, 801]","[619, 628, 614, 671]","1","0.5","280-313","trial_report_best_lambda_0.0.csv"
"0.0","f8d3a162ab9507e021d83dd109118b60","Administration/Industry file","how many LEARNING OUTCOMES should be ANSWERed in UNIT 8? ","[757, 667, 668, 652, 732, 713, 611, 659, 623, 678]","[666, 667, 668]","2","0.67","280-313","trial_report_best_lambda_0.0.csv"
"0.0","f8d3a162ab9507e021d83dd109118b60","Administration/Industry file","what's the topic of UNIT 14?","[725, 693, 629, 609, 712, 685, 701, 610, 657, 665]","[725]","1","1.0","280-313","trial_report_best_lambda_0.0.csv"
"0.0","t480_ug_en","Guidebook","How many connectors are there on the right side view of the computer?","[23945, 25790, 24149, 24129, 24148, 24101, 25726, 24174, 24128, 25793]","[24148, 24149]","3","1.0","280-313","trial_report_best_lambda_0.0.csv"
"0.0","t480_ug_en","Guidebook","How many trackpad gestures does this computer have?","[24401, 24414, 24417, 24411, 24397, 23948, 24398, 24415, 24432, 24412]","[24332, 24333]","Not Found","0.0","280-313","trial_report_best_lambda_0.0.csv"
"0.0","t480_ug_en","Guidebook","Which side of the camera indicator is on the infrared camera lens?","[24578, 24572, 24581, 24579, 24104, 24576, 24107, 24106, 24571, 24105]","[24560, 24577, 24578, 24572]","1","0.5","280-313","trial_report_best_lambda_0.0.csv"
"0.0","t480_ug_en","Guidebook","How many switches do you need to flip to remove the battery?","[25650, 25652, 24222, 22694, 25731, 24178, 26548, 25511, 25820, 24174]","[25650]","1","1.0","280-313","trial_report_best_lambda_0.0.csv"
"0.0","t480_ug_en","Guidebook","Which country or region codes are needed to install Windows 10 in Mainland China?","[24897, 24896, 24237, 24235, 23955, 25061, 22477, 4665, 4653, 4432]","[24897]","1","1.0","280-313","trial_report_best_lambda_0.0.csv"
"0.0","t480_ug_en","Guidebook","Which chemical element in the hard disk exceeds the limit requirements stipulated in the GB/T 26572 standard?","[22241, 26034, 22189, 22248, 22222, 26042, 22243, 22238, 22236, 22185]","[26034]","2","1.0","280-313","trial_report_best_lambda_0.0.csv"
"0.0","t480_ug_en","Guidebook","How many UltraConnect wireless antennas does this computer have?","[25900, 25901, 25899, 25898, 25902, 23966, 26075, 24500, 25894, 24513]","[25901]","2","1.0","280-313","trial_report_best_lambda_0.0.csv"
"0.0","q1-2023-bilibili-inc-investor-presentation","Financial report","By what percentage has gross profit increased in Q1 of 2023 compared to Q1 of 2022?","[19374, 3777, 19375, 3664, 19436, 3645, 3661, 19514, 3660, 19490]","[19369, 19374]","1","0.5","280-313","trial_report_best_lambda_0.0.csv"
"0.0","q1-2023-bilibili-inc-investor-presentation","Financial report","What percentage of users are under 35?","[19384, 8878, 8943, 8877, 8880, 19594, 8945, 8944, 8867, 8962]","[19384, 19378]","1","0.5","280-313","trial_report_best_lambda_0.0.csv"
"0.0","q1-2023-bilibili-inc-investor-presentation","Financial report","What animals appear on page nine? Enumerate them in a list.","[21267, 26493, 21317, 18998, 19856, 2448, 24680, 26557, 24678, 20043]","[19406]","Not Found","0.0","280-313","trial_report_best_lambda_0.0.csv"
"0.0","q1-2023-bilibili-inc-investor-presentation","Financial report","Compared with 22Q1, in 23Q1, how much higher is the increase rate of number of daily average active content creators than average daily video views?","[19417, 19370, 19466, 19481, 19436, 19408, 19414, 19379, 19378, 19457]","[19417, 19414]","1","1.0","280-313","trial_report_best_lambda_0.0.csv"
"0.0","q1-2023-bilibili-inc-investor-presentation","Financial report","How many times does mobile phone appear on pages 16 and 18?","[19612, 8873, 8878, 8877, 8874, 1191, 8880, 8831, 1150, 19596]","[19459, 19461, 19463, 19443, 19446]","Not Found","0.0","280-313","trial_report_best_lambda_0.0.csv"
"0.0","measuringsuccessonfacebooktwitterlinkedin-160317142140_95","Tutorial/Workshop","What is the Source of the data for the audience of the platform whose metrics are page likes, post clicks, video views, post reach, hide, report as spam, unlikes, 30-second views++, post types, engagement: reactions, shares, comments, and FB referral traffic?","[8938, 8992, 8958, 8927, 19417, 1726, 4764, 1730, 1841, 1842]","[8938, 8915]","1","0.5","280-313","trial_report_best_lambda_0.0.csv"
"0.0","measuringsuccessonfacebooktwitterlinkedin-160317142140_95","Tutorial/Workshop","How many likes does the post by Disneyland have on the platform with an audience of 10.6 for Age 65+?","[8915, 8962, 8927, 8943, 17565, 1730, 8944, 1726, 8992, 3852]","[8930, 8915, 8932, 8931]","1","0.25","280-313","trial_report_best_lambda_0.0.csv"
"0.0","measuringsuccessonfacebooktwitterlinkedin-160317142140_95","Tutorial/Workshop","In the two years 2013-2014, in which year is there a lower percentage of users from rural locations on the platform whose measurement tools include Twitter Analytics, Followerwonk, Buffer, and TweetReach?","[8943, 8764, 8944, 8790, 8962, 8946, 8945, 8960, 5391, 8871]","[8960, 8961, 8943, 8957, 8959]","1","0.4","280-313","trial_report_best_lambda_0.0.csv"
"0.0","measuringsuccessonfacebooktwitterlinkedin-160317142140_95","Tutorial/Workshop","In 2013, what is the total percentage of online adult users in the ""White, Non-Hispanic"" and ""Hispanic"" categories on the platform whose metrics include Followers, Tweet Clicks, Video Views, Tweet Reach, Engagement Rate, Completion Rate, Engagement: Mentions, Retweets, Likes, Top Tweet, Top Mention, Top Follower, Top Media Tweet, and Twitter Referral Traffic?","[8958, 8943, 8992, 4764, 1726, 8938, 8962, 1786, 18051, 1725]","[8958, 8943]","1","1.0","280-313","trial_report_best_lambda_0.0.csv"
"0.0","measuringsuccessonfacebooktwitterlinkedin-160317142140_95","Tutorial/Workshop","Which account tweets content tagged #WednesdayWisdom?","[8952, 14507, 1721, 15388, 15788, 14414, 1786, 8951, 17152, 14697]","[8952]","1","1.0","280-313","trial_report_best_lambda_0.0.csv"
"0.0","measuringsuccessonfacebooktwitterlinkedin-160317142140_95","Tutorial/Workshop","What is the total percentage of `college graduate` and `high school or less` on the platform whose measurement tools include Google Analytics?","[8962, 8943, 1187, 1184, 8994, 14750, 1186, 595, 1194, 817]","[8962, 8996]","1","0.5","280-313","trial_report_best_lambda_0.0.csv"
"0.0","measuringsuccessonfacebooktwitterlinkedin-160317142140_95","Tutorial/Workshop","Which metrics are NOT included in LinkedIn Metrics: Post Reach, Post Types, Video Views?","[8938, 8992, 8958, 8962, 8991, 4546, 9264, 8790, 8937, 1260]","[8992, 8938, 8958]","1","1.0","280-313","trial_report_best_lambda_0.0.csv"
"0.0","measuringsuccessonfacebooktwitterlinkedin-160317142140_95","Tutorial/Workshop","What is the total percentage of income > 75k for the LinkedIn platform?","[8962, 8915, 1296, 8943, 8992, 1330, 1295, 1260, 9264, 3986]","[8962]","1","1.0","280-313","trial_report_best_lambda_0.0.csv"
"0.0","mmdetection-readthedocs-io-en-v2.18.0","Guidebook","What's the color of the 'loss_cls' line in the loss curve image?","[10278, 10151, 10406, 10283, 10281, 10154, 10407, 9793, 10145, 12807]","[10278]","1","1.0","280-313","trial_report_best_lambda_0.0.csv"
"0.0","mmdetection-readthedocs-io-en-v2.18.0","Guidebook","If I want to use the detector in the paper `SOLO: Segmenting Objects by Locations`, what is the implemented class name in `mmdet.models.dense_heads`? ","[11993, 14234, 14225, 14255, 12729, 14252, 14238, 12710, 14236, 14230]","[12711]","Not Found","0.0","280-313","trial_report_best_lambda_0.0.csv"
"0.0","mmdetection-readthedocs-io-en-v2.18.0","Guidebook","How many data preparation operators in the classical pipeline?","[9963, 9961, 9967, 9855, 9966, 9962, 9639, 9964, 11541, 11625]","[9963]","1","1.0","280-313","trial_report_best_lambda_0.0.csv"
"0.0","mmdetection-readthedocs-io-en-v2.18.0","Guidebook","Which paper uses the Fast NMS processing?","[11361, 11360, 14229, 11359, 9837, 10734, 10444, 10693, 10594, 11392]","[11360]","2","1.0","280-313","trial_report_best_lambda_0.0.csv"
"0.0","tacl_a_00660","Academic paper","Among the three correction strategies: training-time correction, generation-time correction, and post-hoc correction, which one has the most representative papers in the survey? ","[26140, 26167, 26188, 26143, 26099, 26216, 26168, 26134, 26191, 26187]","[26144, 26134, 26143]","4","0.67","280-313","trial_report_best_lambda_0.0.csv"
"0.0","tacl_a_00660","Academic paper","How many strategies are plotted for training-time correction, generation-time correction, and post-hoc correction, respectively? Write the answer in the list format, e.g., [""1"",""2""]","[26167, 26140, 26143, 26168, 26188, 26127, 26170, 26177, 26169, 26191]","[26144, 26168, 26151]","4","0.33","280-313","trial_report_best_lambda_0.0.csv"
"0.0","tacl_a_00660","Academic paper","For the papers that adopted the Self-Refine strategy in Table 2, how many of them are not mentioned in the ""Self-Correction"" section of page 9? Write the answer in int format.","[26169, 26143, 26168, 26167, 26170, 26309, 26210, 26211, 26216, 26173]","[26158, 26134, 26169, 26170, 26143]","1","0.6","280-313","trial_report_best_lambda_0.0.csv"
"0.0","tacl_a_00660","Academic paper","For the papers that adopted the Model Debate strategy in Table 2, how many of them are not mentioned in Section 3.4? Write the answer in float format.","[6564, 26181, 6565, 26182, 26180, 26143, 26167, 26136, 26183, 10462]","[26179, 26180, 26181, 26182, 26183, 26134, 26170, 26171, 26143]","2","0.56","280-313","trial_report_best_lambda_0.0.csv"
"0.0","tacl_a_00660","Academic paper","For all the papers that are listed in Table 1 and Table 2, how many of them are proposed in 2021?","[26098, 26110, 21963, 3145, 4994, 26187, 10475, 4563, 6688, 7611]","[26134, 26143]","Not Found","0.0","280-313","trial_report_best_lambda_0.0.csv"
"0.0","owners-manual-2170416","Guidebook","In the two styles shown in the ""Parts and Features"" section, are both styles have the egg bin in the picture? Directly answer 'yes' or 'no'.","[19024, 19026, 19045, 27074, 24666, 19158, 24620, 19201, 23899, 24195]","[19024, 19026]","1","1.0","280-313","trial_report_best_lambda_0.0.csv"
"0.0","owners-manual-2170416","Guidebook","In the ""Before Using Your Refrigerator"" Section, ""Installing it properly"" is the step before or after the step ""Plugging it in""? ","[18996, 19031, 19020, 19049, 19050, 19061, 19048, 19030, 19033, 19133]","[19042, 19047]","Not Found","0.0","280-313","trial_report_best_lambda_0.0.csv"
"0.0","owners-manual-2170416","Guidebook","How many steps are required to replace the grille? Write the answer in float format.","[19185, 19187, 19184, 19186, 19183, 19182, 19054, 19342, 19339, 19181]","[19184, 19185]","1","1.0","280-313","trial_report_best_lambda_0.0.csv"
"0.0","f1f5242528411b262be447e61e2eb10f","Academic paper","Which transcript have been included in the translation process in Re-Sense mutation","[226, 223, 220, 10499, 9639, 9842, 222, 9638, 26236, 9749]","[226]","1","1.0","280-313","trial_report_best_lambda_0.0.csv"
"0.0","f1f5242528411b262be447e61e2eb10f","Academic paper","What does a point mutation of the codon TTT or thymine-thymine define?","[222, 225, 221, 223, 227, 228, 226, 214, 285, 312]","[211, 222]","1","0.5","280-313","trial_report_best_lambda_0.0.csv"
"0.0","f1f5242528411b262be447e61e2eb10f","Academic paper","What DNA repair mechanisms does Figure 11 demonstrate?","[324, 326, 325, 327, 329, 328, 330, 323, 331, 298]","[326]","2","1.0","280-313","trial_report_best_lambda_0.0.csv"
"0.0","f1f5242528411b262be447e61e2eb10f","Academic paper","Which step in Figure 1 maps to the content of Figure 10?","[278, 22566, 2478, 2476, 26557, 24103, 26039, 24682, 6677, 24680]","[170, 282]","Not Found","0.0","280-313","trial_report_best_lambda_0.0.csv"
"0.0","f1f5242528411b262be447e61e2eb10f","Academic paper","Which figures depict mutation mechanisms with the double-chain DNA structure?","[310, 229, 230, 214, 192, 285, 326, 286, 193, 287]","[214, 326, 207]","4","0.67","280-313","trial_report_best_lambda_0.0.csv"
"0.0","formwork-150318073913-conversion-gate01_95","Tutorial/Workshop","Is 20mm Sheeting or 25mm Sheeting an appropriate size for timber formwork?","[1386, 1664, 1457, 1458, 1478, 1433, 1607, 1439, 1422, 1470]","[1386]","1","1.0","280-313","trial_report_best_lambda_0.0.csv"
"0.0","formwork-150318073913-conversion-gate01_95","Tutorial/Workshop","How many engineering diagrams are shown to explain the formwork for columns? Any instance is considered as a separate diagram.","[1449, 1433, 1430, 1422, 1607, 1608, 1423, 1436, 1440, 1597]","[1433]","2","1.0","280-313","trial_report_best_lambda_0.0.csv"
"0.0","formwork-150318073913-conversion-gate01_95","Tutorial/Workshop","Which stages of casting a tunnel framework require a heater?","[1591, 1596, 1590, 1584, 1558, 16277, 1579, 1560, 1592, 1583]","[1590]","3","1.0","280-313","trial_report_best_lambda_0.0.csv"
"0.0","formwork-150318073913-conversion-gate01_95","Tutorial/Workshop","How many days of rapid hardening cement are needed for the first structural member shown in the slides?","[1664, 1551, 1591, 1418, 1597, 1595, 1613, 1433, 1380, 1618]","[1664, 1418]","1","1.0","280-313","trial_report_best_lambda_0.0.csv"
"0.0","formwork-150318073913-conversion-gate01_95","Tutorial/Workshop","What are the special forms of column formworks that are illustrated with diagrams in the slides?","[1449, 1433, 1430, 1423, 1607, 1615, 1613, 1422, 1428, 1600]","[1440, 1441, 1442, 1443, 1444, 1445, 1446, 1447, 1448, 1434, 1437, 1438, 1439]","Not Found","0.0","280-313","trial_report_best_lambda_0.0.csv"
"0.0","germanwingsdigitalcrisisanalysis-150403064828-conversion-gate01_95","Research report / Introduction","How many more Tweets are attributed to Germanwings than Lufthansa?","[1786, 1787, 1785, 1767, 1730, 1725, 1762, 1729, 1724, 1769]","[1786]","1","1.0","280-313","trial_report_best_lambda_0.0.csv"
"0.0","germanwingsdigitalcrisisanalysis-150403064828-conversion-gate01_95","Research report / Introduction","How many Tweets are attributed to Germanwings, Lufthansa, and Airbus in total?","[1786, 1787, 1762, 1707, 1724, 1767, 1785, 1730, 1773, 1726]","[1786]","1","1.0","280-313","trial_report_best_lambda_0.0.csv"
"0.0","germanwingsdigitalcrisisanalysis-150403064828-conversion-gate01_95","Research report / Introduction","What colors are the Lufthansa logo within the first 90 minutes and afterward until 120 minutes?","[1730, 1731, 1745, 1729, 1725, 1767, 1769, 1768, 1724, 1766]","[1730, 1725, 1726]","1","0.67","280-313","trial_report_best_lambda_0.0.csv"
"0.0","germanwingsdigitalcrisisanalysis-150403064828-conversion-gate01_95","Research report / Introduction","How many figures are related to Airbus?","[1774, 1745, 1742, 1775, 1791, 1726, 1787, 1772, 1744, 1724]","[1767, 1768, 1769, 1740, 1773, 1774, 1775, 1745, 1726]","1","0.44","280-313","trial_report_best_lambda_0.0.csv"
"0.0","germanwingsdigitalcrisisanalysis-150403064828-conversion-gate01_95","Research report / Introduction","When did the number of tweets referencing Germanwings exceed 200,000? Your report time should be in CET time, like '17:05 CET'.","[1786, 1787, 1801, 1736, 1795, 1740, 1785, 1718, 1697, 1726]","[1805, 1806]","Not Found","0.0","280-313","trial_report_best_lambda_0.0.csv"
"0.0","germanwingsdigitalcrisisanalysis-150403064828-conversion-gate01_95","Research report / Introduction","Is the Germanwings Facebook account logo consistent before and after the first 120 minutes?","[1730, 1729, 1736, 1718, 1726, 1735, 1716, 1731, 1795, 1717]","[1730, 1731, 1736, 1740, 1726]","1","0.8","280-313","trial_report_best_lambda_0.0.csv"
"0.0","germanwingsdigitalcrisisanalysis-150403064828-conversion-gate01_95","Research report / Introduction","In how many hours Airbus incorporated a pop-up notification acknowledging the incident?","[1772, 1724, 1775, 1773, 1790, 1697, 1762, 1786, 1721, 1766]","[1766, 1767, 1768, 1769, 1772, 1773, 1774, 1775]","1","0.5","280-313","trial_report_best_lambda_0.0.csv"
"0.0","germanwingsdigitalcrisisanalysis-150403064828-conversion-gate01_95","Research report / Introduction","How many instances of Lufthansa's official website are presented?","[1767, 1745, 1768, 1769, 1730, 1708, 1707, 1731, 1725, 1766]","[1762, 1767, 1768, 1769, 1740, 1745]","1","0.67","280-313","trial_report_best_lambda_0.0.csv"
"0.0","germanwingsdigitalcrisisanalysis-150403064828-conversion-gate01_95","Research report / Introduction","What are the incident and report dates? Save your answer as a list, with each data formatted as 'YYYY-MM-DD'.","[20684, 4682, 4680, 4683, 4681, 4695, 4703, 4694, 4690, 4704]","[1697, 1695]","Not Found","0.0","280-313","trial_report_best_lambda_0.0.csv"
"0.0","germanwingsdigitalcrisisanalysis-150403064828-conversion-gate01_95","Research report / Introduction","How many percent of Germanwings focused tweets are in English?","[1786, 1785, 1740, 1736, 1787, 1795, 1721, 1836, 1801, 1726]","[1785]","2","1.0","280-313","trial_report_best_lambda_0.0.csv"
"0.0","efis-140411041451-phpapp01_95","Tutorial/Workshop","Which seven sensors are connected to the ECU?","[59, 133, 151, 64, 68, 135, 69, 91, 66, 99]","[59, 53]","1","0.5","280-313","trial_report_best_lambda_0.0.csv"
"0.0","efis-140411041451-phpapp01_95","Tutorial/Workshop","In which system the throttle valve is placed beneath the fuel injector?","[25, 33, 32, 36, 143, 151, 37, 23, 139, 29]","[32, 25]","1","1.0","280-313","trial_report_best_lambda_0.0.csv"
"0.0","efis-140411041451-phpapp01_95","Tutorial/Workshop","How many figures illustrated the structure of fuel injectors?","[37, 143, 151, 45, 42, 85, 36, 133, 46, 39]","[42, 45]","4","1.0","280-313","trial_report_best_lambda_0.0.csv"
"0.0","efis-140411041451-phpapp01_95","Tutorial/Workshop","What temperature sensors are illustrated with figures in the slides?","[111, 123, 110, 91, 1024, 133, 107, 106, 127, 79]","[111, 112, 113, 114, 115, 117, 118, 122, 123, 124]","1","0.2","280-313","trial_report_best_lambda_0.0.csv"
"0.0","efis-140411041451-phpapp01_95","Tutorial/Workshop","What are connected with fuel supply?","[53, 151, 148, 60, 54, 26595, 59, 75, 57, 81]","[53, 151]","1","1.0","280-313","trial_report_best_lambda_0.0.csv"
"0.0","efis-140411041451-phpapp01_95","Tutorial/Workshop","How many outputs does the example ECU have?","[59, 68, 66, 24, 67, 31, 133, 69, 64, 65]","[59, 53]","1","0.5","280-313","trial_report_best_lambda_0.0.csv"
"0.0","san-francisco-11-contents","Guidebook","What is the Pier with the longest coast line?","[21033, 21100, 21082, 21006, 21104, 21150, 21029, 21086, 21298, 21167]","[21082]","3","1.0","280-313","trial_report_best_lambda_0.0.csv"
"0.0","san-francisco-11-contents","Guidebook","Name a restaurant between 36th Ave. and 37th Ave..","[21301, 21292, 21018, 21331, 21262, 21330, 21188, 21012, 21111, 21155]","[21330, 21319]","6","0.5","280-313","trial_report_best_lambda_0.0.csv"
"0.0","transform-software-delivery-with-valueedge-brochure","Brochure","What are the services of ValueEdge ops?","[26484, 26483, 26482, 26485, 26420, 26440, 26469, 26457, 26438, 26448]","[26484]","1","1.0","280-313","trial_report_best_lambda_0.0.csv"
"0.0","transform-software-delivery-with-valueedge-brochure","Brochure","What is the title of the page that contains a screenshot?","[18217, 1774, 11594, 18208, 18209, 18223, 18211, 1768, 18201, 1730]","[26438]","Not Found","0.0","280-313","trial_report_best_lambda_0.0.csv"
"0.0","transform-software-delivery-with-valueedge-brochure","Brochure","What is the name of the workspace shown as an example?","[10224, 24609, 26440, 10225, 18386, 5410, 18179, 21199, 819, 6160]","[26438]","Not Found","0.0","280-313","trial_report_best_lambda_0.0.csv"
"0.0","transform-software-delivery-with-valueedge-brochure","Brochure","What are the five steps of ValueEdge Insights?","[26484, 26438, 26440, 26441, 26402, 26439, 26444, 26443, 26487, 26442]","[26484]","1","1.0","280-313","trial_report_best_lambda_0.0.csv"
